name,parent_id/name,content,tag_ids/name,x_task_ids/name,owner_id/email,summary
Operations Workspace,,"<h1>Welcome to Operations Workspace</h1><p>This is your central hub for compliance, finance, and operational knowledge.</p><h2>Quick Links</h2><ul><li>Month-End Closing Process</li><li>Tax Filing Guidelines</li><li>Procurement Procedures</li><li>Expense Management</li></ul>","Workspace,Home",admin@company.com,Main workspace landing page
Month-End Closing SOP,Operations Workspace,"<h1>Month-End Closing Standard Operating Procedure</h1><h2>Overview</h2><p>This SOP outlines the complete month-end closing process for the Finance team.</p><h2>Timeline</h2><ul><li>Day 1-5: Preliminary reconciliations</li><li>Day 6-10: Adjusting entries</li><li>Day 11-15: Final reconciliations</li><li>Day 16-20: Financial statement preparation</li><li>Day 21-25: Review and approval</li></ul><h2>Key Tasks</h2><ol><li>Bank reconciliations (all accounts)</li><li>Inventory reconciliation</li><li>Accounts receivable aging review</li><li>Accounts payable aging review</li><li>Prepayments and accruals review</li><li>Fixed asset depreciation</li><li>Journal entry posting and review</li><li>Trial balance preparation</li><li>Financial statement preparation</li><li>Variance analysis</li></ol><h2>Responsible Parties</h2><ul><li>Staff Accountant: Reconciliations and journal entries</li><li>Senior Accountant: Review and variance analysis</li><li>Finance Manager: Financial statements and approvals</li><li>CFO: Final review and sign-off</li></ul>","Month-End,SOP,Finance",Complete Month-End Closing,accountant@company.com,Step-by-step guide for month-end closing procedures
Tax Filing Guide,Operations Workspace,"<h1>Tax Filing Guide - Philippines</h1><h2>Monthly Tax Obligations</h2><h3>Withholding Tax (Form 2550M)</h3><ul><li><strong>Due Date:</strong> 10th day of the following month</li><li><strong>Description:</strong> Monthly remittance return of income taxes withheld</li><li><strong>Filing Method:</strong> eFPS (Electronic Filing and Payment System)</li><li><strong>Responsible:</strong> Tax team</li></ul><h3>Expanded Withholding Tax (Form 2551M)</h3><ul><li><strong>Due Date:</strong> 10th day of the following month</li><li><strong>Description:</strong> Monthly remittance return of creditable income taxes withheld (expanded)</li></ul><h2>Quarterly Tax Obligations</h2><h3>Income Tax Return (Form 1701Q)</h3><ul><li><strong>Due Date:</strong> 60 days after the close of each quarter</li><li><strong>Description:</strong> Quarterly income tax return for corporations</li></ul><h2>Annual Tax Obligations</h2><h3>Annual Income Tax Return (Form 1702)</h3><ul><li><strong>Due Date:</strong> April 15 (for calendar year ending Dec 31)</li><li><strong>Description:</strong> Annual income tax return for corporations</li></ul><h2>Important Reminders</h2><ul><li>Always file on or before the deadline</li><li>Keep digital and physical copies of all filed returns</li><li>Update tax mapping codes regularly</li><li>Coordinate with external tax advisors for complex cases</li></ul>","Tax,BIR,Guidelines","Tax Filing - BIR Form 2550M",tax@company.com,Comprehensive guide to Philippine tax filing requirements
Bank Reconciliation SOP,Operations Workspace,"<h1>Bank Reconciliation Standard Operating Procedure</h1><h2>Purpose</h2><p>To ensure accuracy of bank balances and identify discrepancies timely.</p><h2>Frequency</h2><p>Monthly, by the 5th working day after month-end</p><h2>Procedure</h2><ol><li>Download bank statements from all bank portals</li><li>Export Odoo cash/bank transactions for the period</li><li>Open bank reconciliation module in Odoo</li><li>Match transactions automatically (90% auto-match expected)</li><li>Manually review and match remaining items</li><li>Identify and document unreconciled items:<ul><li>Outstanding checks</li><li>Deposits in transit</li><li>Bank charges not yet recorded</li><li>Errors or discrepancies</li></ul></li><li>Prepare journal entries for unrecorded bank charges/interest</li><li>Generate reconciliation report</li><li>Submit for review (Senior Accountant)</li><li>File bank statement and reconciliation report in DMS</li></ol><h2>Tools</h2><ul><li>Odoo Banking module</li><li>Bank online portals</li><li>Excel templates (for complex reconciliations)</li></ul><h2>Escalation</h2><p>If discrepancies exceed PHP 10,000 or cannot be explained, escalate immediately to Finance Manager.</p>","Month-End,Reconciliation,SOP",Reconcile Bank Accounts,accountant@company.com,Detailed bank reconciliation procedures
Procurement Process,Operations Workspace,"<h1>Procurement Standard Operating Procedure</h1><h2>Overview</h2><p>This SOP covers the end-to-end procurement process from vendor selection to payment.</p><h2>Vendor Management Process</h2><h3>1. Vendor Rate Request (Account Manager)</h3><ol><li>Identify need for new vendor or rate review</li><li>Create vendor rate request in Odoo (Procurement module)</li><li>Specify: Service/Product, Quantity, Timeline, Budget range</li><li>Submit for Finance Director approval</li><li><strong>Note:</strong> Account Managers can only see vendor roles/expertise, not names or rates (confidential)</li></ol><h3>2. Finance Director Approval</h3><ol><li>Review rate request against budget</li><li>Approve or reject with comments</li><li>If approved, assign to Procurement team</li></ol><h3>3. Vendor Sourcing (Procurement Team)</h3><ol><li>Send RFQ (Request for Quotation) to qualified vendors</li><li>Collect vendor quotations (minimum 3 vendors)</li><li>Evaluate based on: Price, Quality, Delivery time, Past performance</li><li>Prepare vendor comparison matrix</li></ol><h3>4. Vendor Selection & PO Creation</h3><ol><li>Select winning vendor</li><li>Create Purchase Order in Odoo</li><li>Route for approvals (based on amount thresholds)</li><li>Send PO to vendor</li></ol><h2>Approval Thresholds</h2><ul><li>Up to PHP 50,000: Procurement Manager</li><li>PHP 50,001 - 200,000: Finance Director</li><li>PHP 200,001 - 500,000: CFO</li><li>Above PHP 500,000: CEO + Board approval</li></ul><h2>Payment Terms</h2><ul><li>Standard: 30 days from invoice date</li><li>Early payment discount: 2/10 net 30 (if offered)</li><li>Advance payment: Requires CFO approval</li></ul>","Procurement,SOP,Vendor Management",Vendor Rate Request - Digital Marketing,am@company.com,Complete procurement process from vendor selection to payment
Expense Management Policy,Operations Workspace,"<h1>Expense Management Policy</h1><h2>Overview</h2><p>This policy governs all employee expense reimbursements and company credit card usage.</p><h2>Reimbursable Expenses</h2><ul><li>Transportation (business travel only)</li><li>Meals and entertainment (with business purpose)</li><li>Accommodation (approved business trips)</li><li>Office supplies and equipment</li><li>Professional development (pre-approved)</li><li>Client entertainment (within limits)</li></ul><h2>Non-Reimbursable Expenses</h2><ul><li>Personal expenses</li><li>Commuting to regular workplace</li><li>Alcoholic beverages (unless client entertainment)</li><li>Personal entertainment</li><li>Traffic violations and parking fines</li></ul><h2>Expense Submission Process</h2><ol><li>Incur expense with valid business purpose</li><li>Obtain official receipt (OR) or sales invoice</li><li>Take clear photo/scan of receipt</li><li>Upload to Odoo Expense module within 7 days</li><li>Fill expense details: Date, Amount, Category, Business purpose</li><li>Submit expense report by month-end</li><li>Route to manager for approval</li><li>Finance Director final approval (amounts > PHP 10,000)</li><li>Reimbursement via payroll or bank transfer (within 15 days)</li></ol><h2>Receipt Requirements</h2><ul><li>Must be official receipt (OR) or sales invoice</li><li>Must include: TIN, Business name, Address, Date, Amount</li><li>For transportation: Grab/Taxi receipt, Flight tickets, Gas receipts</li><li>For meals: Restaurant official receipt with business purpose note</li></ul><h2>OCR Processing</h2><p>All expense receipts are automatically processed via OCR to extract key data. Review OCR results for accuracy before submission.</p><h2>Approval Limits</h2><ul><li>Up to PHP 5,000: Direct Manager</li><li>PHP 5,001 - 10,000: Department Head</li><li>PHP 10,001 - 50,000: Finance Director</li><li>Above PHP 50,000: CFO approval required</li></ul>","Expenses,Policy,Reimbursement",Review Expense Reports,finance.director@company.com,Employee expense reimbursement policy and procedures
Financial Reporting Guide,Operations Workspace,"<h1>Financial Reporting Guide</h1><h2>Monthly Financial Statements</h2><h3>Required Reports</h3><ol><li><strong>Balance Sheet</strong><ul><li>Assets (current and non-current)</li><li>Liabilities (current and non-current)</li><li>Equity</li></ul></li><li><strong>Income Statement</strong><ul><li>Revenue</li><li>Cost of sales</li><li>Operating expenses</li><li>Other income/expenses</li><li>Net income</li></ul></li><li><strong>Cash Flow Statement (Indirect method)</strong><ul><li>Operating activities</li><li>Investing activities</li><li>Financing activities</li></ul></li></ol><h3>Reporting Timeline</h3><ul><li>Preliminary reports: 10 working days after month-end</li><li>Final reports: 15 working days after month-end</li><li>Management review: 18 working days after month-end</li><li>Board presentation (quarterly): 20 working days after quarter-end</li></ul><h2>Key Financial Metrics</h2><ul><li>Current ratio (>= 1.5)</li><li>Quick ratio (>= 1.0)</li><li>Debt-to-equity ratio (<= 1.0)</li><li>Gross profit margin (target: 40%)</li><li>Operating profit margin (target: 15%)</li><li>Net profit margin (target: 10%)</li><li>Days sales outstanding (DSO) (target: <= 45 days)</li><li>Days payable outstanding (DPO) (target: 30 days)</li><li>Inventory turnover (target: >= 6x per year)</li></ul><h2>Variance Analysis</h2><p>Explain all variances > 10% or PHP 100,000 (whichever is lower) vs:</p><ul><li>Prior month</li><li>Same month prior year</li><li>Budget/forecast</li></ul><h2>Distribution</h2><ul><li>CEO, CFO, Finance Director: Full package</li><li>Department Heads: Income statement and departmental reports</li><li>Board of Directors: Quarterly full package</li></ul>","Reporting,Finance,SOP",Prepare Financial Statements,cfo@company.com,Financial statement preparation and reporting guidelines
